{
  "date": "2026-03-03",
  "tool": "a11y-audit v6",
  "pages": [
    "http://localhost:3000/",
    "http://localhost:3000/about"
  ],
  "expected_url": "http://localhost:3000",
  "runtime_url": "http://127.0.0.1:3001",
  "lighthouse": {
    "status": "skipped",
    "reason": "Lighthouse CLI unavailable in workspace"
  },
  "summary": {
    "critical": 0,
    "serious": 3,
    "moderate": 9,
    "minor": 0
  },
  "violations": [
    {
      "rule": "color-contrast",
      "impact": "serious",
      "wcag": ["1.4.3"],
      "pages": ["/", "/about"],
      "instances": 3
    }
  ],
  "matrix": {
    "1.3.1": "fail",
    "1.4.3": "fail",
    "2.4.3": "manual"
  }
}
